,title,media,date,datetime,desc,link,img
45,Coronavirus pandemic impacted the poorest children in East Devon,Sidmouth Herald,6 days ago,2024-09-06 04:53:40.686827,"pupils return to schools for the new academic year, we look at the impact of the coronavirus pandemic on children in East Devon and across the UK.",https://www.sidmouthherald.co.uk/news/24565033.coronavirus-pandemic-impacted-poorest-children-east-devon/&ved=2ahUKEwjy_Lamkb2IAxViLtAFHQwtNXA4KBDF9AF6BAgDEAI&usg=AOvVaw2kyN-xLAHUuDjApyGwI120,"data:image/gif;base64,R0lGODlhAQABAIAAAP///////yH5BAEKAAEALAAAAAABAAEAAAICTAEAOw=="
46,How the coronavirus pandemic impacted the poorest children in Bassetlaw,Worksop Guardian,1 week ago,2024-09-05 04:53:40.691219,"As pupils return to schools for the new academic year, we look at the impact of the coronavirus pandemic on children in Bassetlaw and across the UK.",https://www.worksopguardian.co.uk/news/people/how-the-coronavirus-pandemic-impacted-the-poorest-children-in-bassetlaw-4770015&ved=2ahUKEwjy_Lamkb2IAxViLtAFHQwtNXA4KBDF9AF6BAgBEAI&usg=AOvVaw2M6gy515E2ZMBZ0sIlhY7-,"data:image/gif;base64,R0lGODlhAQABAIAAAP///////yH5BAEKAAEALAAAAAABAAEAAAICTAEAOw=="
47,"Photos show Chinese medics flying to epicentre of coronavirus outbreak, not 'deployed to aid Russia'",AFP Fact Check,1 week ago,2024-09-05 04:53:40.695511,Images of Chinese medics boarding a plane to Wuhan at the start of the Covid-19 pandemic have resurfaced in social media posts that falsely claimed they...,https://factcheck.afp.com/doc.afp.com.36FD73Z&ved=2ahUKEwjy_Lamkb2IAxViLtAFHQwtNXA4KBDF9AF6BAgHEAI&usg=AOvVaw0X4Aza_1hhSHzdx5vP4YPy,"data:image/gif;base64,R0lGODlhAQABAIAAAP///////yH5BAEKAAEALAAAAAABAAEAAAICTAEAOw=="
48,NY officials urge residents to get COVID vaccine,WBGO,1 week ago,2024-09-05 04:53:40.699526,"The newly updated coronavirus vaccine is now available in New York state. With the weather turning, and respiratory illness season ahead, officials expect...",https://www.wbgo.org/news/2024-09-04/ny-officials-urge-residents-to-get-covid-vaccine&ved=2ahUKEwjy_Lamkb2IAxViLtAFHQwtNXA4KBDF9AF6BAgIEAI&usg=AOvVaw2GiY8a0SAvZi6X-PrATWNK,"data:image/gif;base64,R0lGODlhAQABAIAAAP///////yH5BAEKAAEALAAAAAABAAEAAAICTAEAOw=="
49,Dozens of ‘high-risk’ viruses discovered on fur farms in China,EL PAÍS English,1 week ago,2024-09-05 04:53:40.703532,"Coronaviruses, influenzas and other potentially dangerous pathogens infect raccoon dogs, mink, and foxes bred for the fur trade.",https://english.elpais.com/science-tech/2024-09-04/dozens-of-high-risk-viruses-discovered-on-fur-farms-in-china.html&ved=2ahUKEwjy_Lamkb2IAxViLtAFHQwtNXA4KBDF9AF6BAgCEAI&usg=AOvVaw3fcHfkOgheEMxKHxSWlHFX,"data:image/gif;base64,R0lGODlhAQABAIAAAP///////yH5BAEKAAEALAAAAAABAAEAAAICTAEAOw=="
50,Dangerous new coronavirus is one of more than 30 pathogens found in new study of Chinese fur farms,The Telegraph,1 week ago,2024-09-05 04:53:41.143374,"Nature paper says 'zoonotic soup' of viruses in farmed animals much greater than previously reported, raising pandemic spillover fears.",https://www.telegraph.co.uk/global-health/science-and-disease/dangerous-new-coronavirus-is-one-of-more-than-30-pathogens/&ved=2ahUKEwjqssymkb2IAxWQLtAFHSVUOJY4MhDF9AF6BAgGEAI&usg=AOvVaw3tlYlnN4dbipRETNuzEg__,"data:image/gif;base64,R0lGODlhAQABAIAAAP///////yH5BAEKAAEALAAAAAABAAEAAAICTAEAOw=="
51,Global Coronavirus Therapeutics Market Size Projected to Exceed $16 Billion By the End of 2031,GlobeNewswire,1 week ago,2024-09-05 04:53:41.151577,"PALM BEACH, Fla., Sept. 04, 2024 (GLOBE NEWSWIRE) -- FN Media Group News Commentary - The emergence of SARS-CoV-2, which triggered the COVID-19 pandemic...",https://www.globenewswire.com/news-release/2024/09/04/2940504/0/en/Global-Coronavirus-Therapeutics-Market-Size-Projected-to-Exceed-16-Billion-By-the-End-of-2031.html&ved=2ahUKEwjqssymkb2IAxWQLtAFHSVUOJY4MhDF9AF6BAgJEAI&usg=AOvVaw2keoc4KJHPMZrp_m72QP9S,"data:image/gif;base64,R0lGODlhAQABAIAAAP///////yH5BAEKAAEALAAAAAABAAEAAAICTAEAOw=="
52,Federal Funding for Free COVID Vaccines Has Ended,Vision Monday,1 week ago,2024-09-05 04:53:41.158747,A federal program that helped people get COVID-19 vaccines at no cost has ended. That means uninsured people may be asked to pay as much as $200 for the...,https://www.visionmonday.com/eyecare/coronavirus-briefing/crisis-response-tactics/article/federal-funding-for-free-covid-vaccines-has-ended/&ved=2ahUKEwjqssymkb2IAxWQLtAFHSVUOJY4MhDF9AF6BAgDEAI&usg=AOvVaw2f2vs13ldzDIb93der3olN,"data:image/gif;base64,R0lGODlhAQABAIAAAP///////yH5BAEKAAEALAAAAAABAAEAAAICTAEAOw=="
53,Who can get an NHS Covid jab this autumn?,BBC,1 week ago,2024-09-05 04:53:41.165150,The NHS autumn booster campaign begins in October but Covid vaccines are also available privately.,https://www.bbc.co.uk/news/health-55045639&ved=2ahUKEwjqssymkb2IAxWQLtAFHSVUOJY4MhDF9AF6BAgBEAI&usg=AOvVaw0XtAfUXzua5coWfVOJT7T5,"data:image/gif;base64,R0lGODlhAQABAIAAAP///////yH5BAEKAAEALAAAAAABAAEAAAICTAEAOw=="
54,Nevada is among the states with very high COVID-19 levels,Nevada Public Radio | KNPR,1 week ago,2024-09-05 04:53:41.170751,"The U.S. is in the midst of the largest COVID-19 wave we've seen since July 2022, according to CDC data.",https://knpr.org/show/knprs-state-of-nevada/2024-09-03/nevada-is-among-the-states-with-very-high-covid-19-levels&ved=2ahUKEwjqssymkb2IAxWQLtAFHSVUOJY4MhDF9AF6BAgAEAI&usg=AOvVaw3OzRx4e5XNJKQAHkiIyEIu,"data:image/gif;base64,R0lGODlhAQABAIAAAP///////yH5BAEKAAEALAAAAAABAAEAAAICTAEAOw=="
55,COVID-19 Vaccine Basics,Centers for Disease Control and Prevention | CDC (.gov),1 week ago,2024-09-05 04:53:41.176215,Learn how COVID-19 vaccines help our bodies develop immunity to the virus that causes COVID-19.,https://www.cdc.gov/covid/vaccines/how-they-work.html&ved=2ahUKEwjqssymkb2IAxWQLtAFHSVUOJY4MhDF9AF6BAgHEAI&usg=AOvVaw1tcx0YTXTEuwLzmf2OUekd,"data:image/gif;base64,R0lGODlhAQABAIAAAP///////yH5BAEKAAEALAAAAAABAAEAAAICTAEAOw=="
56,Former Gov. Cuomo to appear before Congress on coronavirus response,SILive.com,1 week ago,2024-09-05 04:53:41.181286,"STATEN ISLAND, N.Y. — Former Gov. Andrew Cuomo will testify before Congress Sept. 10 over his handling of the coronavirus (COVID-19) pandemic.",https://www.silive.com/news/2024/09/former-gov-cuomo-to-appear-before-congress-on-coronavirus-response.html&ved=2ahUKEwjqssymkb2IAxWQLtAFHSVUOJY4MhDF9AF6BAgEEAI&usg=AOvVaw1Jnm4rDggDWrVbNACBm8G9,"data:image/gif;base64,R0lGODlhAQABAIAAAP///////yH5BAEKAAEALAAAAAABAAEAAAICTAEAOw=="
57,This was a 'prime weekend' for COVID spread in California. Why experts see a 'real risk' ahead,Los Angeles Times,1 week ago,2024-09-05 04:53:41.186035,"COVID remains at stubbornly high levels in California, and officials warn that transmission could again accelerate following the busy Labor Day holiday...",https://www.latimes.com/california/story/2024-09-03/post-labor-day-poses-new-covid-risk-for-california-will-the-wave-get-worse&ved=2ahUKEwjqssymkb2IAxWQLtAFHSVUOJY4MhDF9AF6BAgFEAI&usg=AOvVaw0-II2_W_tNKBesiRRKJMaL,"data:image/gif;base64,R0lGODlhAQABAIAAAP///////yH5BAEKAAEALAAAAAABAAEAAAICTAEAOw=="
58,Newly Discovered Antibody Protects Against All COVID-19 Variants,UT News,1 week ago,2024-09-05 04:53:41.190657,"News, stories, and opinions on science, technology, health, education, business, policy, campus life, and more from The University of Texas at Austin.",https://news.utexas.edu/2024/09/03/newly-discovered-antibody-protects-against-all-covid-19-variants/&ved=2ahUKEwjqssymkb2IAxWQLtAFHSVUOJY4MhDF9AF6BAgCEAI&usg=AOvVaw1x7BZR1oNnuX8Z_rQ9zDUX,"data:image/gif;base64,R0lGODlhAQABAIAAAP///////yH5BAEKAAEALAAAAAABAAEAAAICTAEAOw=="
59,Covid is Circulating at High Levels This Summer. Here’s What to Know.,The New York Times,1 week ago,2024-09-05 04:53:41.194944,"We asked experts about symptoms of newer Covid variants, as well as testing and treatment.",https://www.nytimes.com/2024/06/03/well/live/covid-symptoms-treatment-flirt-variants.html&ved=2ahUKEwjqssymkb2IAxWQLtAFHSVUOJY4MhDF9AF6BAgIEAI&usg=AOvVaw3bTDS71v09BFATfFlX8eVc,"data:image/gif;base64,R0lGODlhAQABAIAAAP///////yH5BAEKAAEALAAAAAABAAEAAAICTAEAOw=="
60,Newly Discovered Antibody Protects Against All COVID-19 Variants,UT News,1 week ago,2024-09-05 04:53:41.518247,"News, stories, and opinions on science, technology, health, education, business, policy, campus life, and more from The University of Texas at Austin.",https://news.utexas.edu/2024/09/03/newly-discovered-antibody-protects-against-all-covid-19-variants/&ved=2ahUKEwilpeqmkb2IAxWb3skDHS89C2o4PBDF9AF6BAgCEAI&usg=AOvVaw3XKMZpowG5FkQBlgo4U1sY,"data:image/gif;base64,R0lGODlhAQABAIAAAP///////yH5BAEKAAEALAAAAAABAAEAAAICTAEAOw=="
61,Former Gov. Cuomo to appear before Congress on coronavirus response,SILive.com,1 week ago,2024-09-05 04:53:41.526379,"STATEN ISLAND, N.Y. — Former Gov. Andrew Cuomo will testify before Congress Sept. 10 over his handling of the coronavirus (COVID-19) pandemic.",https://www.silive.com/news/2024/09/former-gov-cuomo-to-appear-before-congress-on-coronavirus-response.html&ved=2ahUKEwilpeqmkb2IAxWb3skDHS89C2o4PBDF9AF6BAgJEAI&usg=AOvVaw1I7wXXIfI5TJV11MOPjj6S,"data:image/gif;base64,R0lGODlhAQABAIAAAP///////yH5BAEKAAEALAAAAAABAAEAAAICTAEAOw=="
62,California coronavirus cases: Tracking the outbreak,Los Angeles Times,2 weeks ago,2024-08-29 04:53:41.533647,"This page tracks the latest available data on COVID-19 hospitalizations, cases, deaths, variants and vaccinations from the California Department of Public...",https://www.latimes.com/projects/california-coronavirus-cases-tracking-outbreak/&ved=2ahUKEwilpeqmkb2IAxWb3skDHS89C2o4PBDF9AF6BAgIEAI&usg=AOvVaw2pSBtGDgf68RJbeOIepgJb,"data:image/gif;base64,R0lGODlhAQABAIAAAP///////yH5BAEKAAEALAAAAAABAAEAAAICTAEAOw=="
63,Coronavirus reported at Quincy veterans home reflects increased spread of COVID-19,STLPR,2 weeks ago,2024-08-29 04:53:41.540150,More than 20 people have caught coronavirus at the state-run facility. They're among three dozen residents and workers at three of the state's five veterans...,https://www.stlpr.org/health-science-environment/2024-08-30/coronavirus-reported-at-quincy-veterans-home-reflects-increased-spread-of-covid-19&ved=2ahUKEwilpeqmkb2IAxWb3skDHS89C2o4PBDF9AF6BAgEEAI&usg=AOvVaw1S1VSMSnVsvtkKMIPyvpqK,"data:image/gif;base64,R0lGODlhAQABAIAAAP///////yH5BAEKAAEALAAAAAABAAEAAAICTAEAOw=="
64,"COVID-19 , flu and RSV shots − an epidemiologist explains why all three matter this fall",The Conversation,2 weeks ago,2024-08-29 04:53:41.546209,The summer 2024 COVID-19 wave is a good reminder that it's important to get vaccinated with the updated shot.,https://theconversation.com/covid-19-flu-and-rsv-shots-an-epidemiologist-explains-why-all-three-matter-this-fall-237443&ved=2ahUKEwilpeqmkb2IAxWb3skDHS89C2o4PBDF9AF6BAgFEAI&usg=AOvVaw39BZS8wJct_IMBPmwGJB9w,"data:image/gif;base64,R0lGODlhAQABAIAAAP///////yH5BAEKAAEALAAAAAABAAEAAAICTAEAOw=="
65,Covid associated with increased risk for hearing loss in young adults,The Washington Post,2 weeks ago,2024-08-29 04:53:41.551593,"The incidences of hearing loss and sudden deafness were higher for people who had covid than those who did not, a new study reports.",https://www.washingtonpost.com/wellness/2024/08/29/covid-hearing-loss-deafness-risk-study/&ved=2ahUKEwilpeqmkb2IAxWb3skDHS89C2o4PBDF9AF6BAgHEAI&usg=AOvVaw0eppAKGu29gJo3YtoL3-xi,"data:image/gif;base64,R0lGODlhAQABAIAAAP///////yH5BAEKAAEALAAAAAABAAEAAAICTAEAOw=="
66,"COVID-19 cases jump 2,000, to more than 10,000, as Ohio pushes new vaccine: Coronavirus update for Thursday,",Cleveland.com,2 weeks ago,2024-08-29 04:53:41.556679,This week saw the weekly case number climb over the 10000-mark for the first time since January.It also was the 13th straight week that the case number has...,https://www.cleveland.com/metro/2024/08/covid-19-cases-jump-2000-to-more-than-10000-as-ohio-pushes-new-vaccine-coronavirus-update-for-thursday-aug-29.html&ved=2ahUKEwilpeqmkb2IAxWb3skDHS89C2o4PBDF9AF6BAgAEAI&usg=AOvVaw3SQ1y3uZ4A-tdM0BYmLQ_C,"data:image/gif;base64,R0lGODlhAQABAIAAAP///////yH5BAEKAAEALAAAAAABAAEAAAICTAEAOw=="
67,"Vaccines: COVID-19, Influenza, and RSV | Marin County Coronavirus Information",Marin Health and Human Services,2 weeks ago,2024-08-29 04:53:41.561365,"You can get a flu vaccine (6 months and up), COVID-19 (ages 3 and up), and RSV vaccine (age 60 and up, need to verify insurance coverage) at local pharmacies.",https://coronavirus.marinhhs.org/vaccine&ved=2ahUKEwilpeqmkb2IAxWb3skDHS89C2o4PBDF9AF6BAgDEAI&usg=AOvVaw0yFSR4phmy-RKGfzvXGSQP,"data:image/gif;base64,R0lGODlhAQABAIAAAP///////yH5BAEKAAEALAAAAAABAAEAAAICTAEAOw=="
68,How to Get Free COVID Tests Fall 2024: Here's When You Can Order,TODAY.com,2 weeks ago,2024-08-29 04:53:41.565911,"Starting this fall, you will be able to order another round of free COVID-19 tests from the government. Here's when and how to order them.",https://www.today.com/health/coronavirus/how-to-get-free-covid-tests-2024-rcna167967&ved=2ahUKEwilpeqmkb2IAxWb3skDHS89C2o4PBDF9AF6BAgBEAI&usg=AOvVaw2KPaVll1A6oLhu5rWR5N7c,"data:image/gif;base64,R0lGODlhAQABAIAAAP///////yH5BAEKAAEALAAAAAABAAEAAAICTAEAOw=="
69,Healthcare Professionals,Virginia Department of Health (.gov),2 weeks ago,2024-08-29 04:53:41.570227,"Healthcare Professionals. This page includes information on vaccination, treatment, testing, and other COVID-19 topics. Thank you for your continued work to...",https://www.vdh.virginia.gov/coronavirus/get-the-latest-guidance/health-professionals/&ved=2ahUKEwilpeqmkb2IAxWb3skDHS89C2o4PBDF9AF6BAgGEAI&usg=AOvVaw3-QXc_8lCk1-FiFKxFiujr,"data:image/gif;base64,R0lGODlhAQABAIAAAP///////yH5BAEKAAEALAAAAAABAAEAAAICTAEAOw=="
70,Testing for COVID-19,Centers for Disease Control and Prevention | CDC (.gov),3 weeks ago,2024-08-22 04:53:41.956704,"COVID-19 testing can help you know if you have COVID-19 so you can decide what to do next, like getting treatment to reduce your risk of severe illness.",https://www.cdc.gov/covid/testing/index.html&ved=2ahUKEwibm4Gnkb2IAxXYMdAFHa9gA-k4RhDF9AF6BAgFEAI&usg=AOvVaw37jtH1dcTD2Hl3jDrsq24T,"data:image/gif;base64,R0lGODlhAQABAIAAAP///////yH5BAEKAAEALAAAAAABAAEAAAICTAEAOw=="
71,FDA Okays Updated COVID-19 Vaccines From Pfizer and Moderna,Everyday Health,3 weeks ago,2024-08-22 04:53:41.965048,Experts say the reformulated shots provide better protection against the variants that are still driving a summer wave of infection.,https://www.everydayhealth.com/coronavirus/updated-covid-vaccines-for-2024-2025-gets-fda-approval/&ved=2ahUKEwibm4Gnkb2IAxXYMdAFHa9gA-k4RhDF9AF6BAgJEAI&usg=AOvVaw3rvol41rlROysFTv68--bN,"data:image/gif;base64,R0lGODlhAQABAIAAAP///////yH5BAEKAAEALAAAAAABAAEAAAICTAEAOw=="
72,"New Novavax, mRNA coronavirus vaccines are approved. Here’s what to know.",Washington Post,3 weeks ago,2024-08-22 04:53:41.972586,"The 2023-2024 vaccine provided 54 percent increased protection against symptomatic covid infections, according to a CDC study of people who tested for the...",https://www.washingtonpost.com/health/2024/08/22/new-coronavirus-vaccine-covid/&ved=2ahUKEwibm4Gnkb2IAxXYMdAFHa9gA-k4RhDF9AF6BAgIEAI&usg=AOvVaw3RfdeTJNL6MNeqSk7WLfKw,"data:image/gif;base64,R0lGODlhAQABAIAAAP///////yH5BAEKAAEALAAAAAABAAEAAAICTAEAOw=="
73,COVID-19 Data Explorer,Our World in Data,3 weeks ago,2024-08-22 04:53:41.979236,"Estimated cumulative excess deaths per 100,000 people during COVID-19, Jun 17, 2024. For countries that have not reported all-cause mortality data for...",https://ourworldindata.org/explorers/covid&ved=2ahUKEwibm4Gnkb2IAxXYMdAFHa9gA-k4RhDF9AF6BAgDEAI&usg=AOvVaw2Zt7ymynYXzSwFeqiZG9l9,"data:image/gif;base64,R0lGODlhAQABAIAAAP///////yH5BAEKAAEALAAAAAABAAEAAAICTAEAOw=="
74,Molecular architecture of coronavirus double-membrane vesicle pore complex,Nature,1 month ago,2024-08-12 04:53:41.986326,"Coronaviruses remodel the intracellular host membranes during replication, forming double-membrane vesicles (DMVs) to accommodate viral RNA synthesis and...",https://www.nature.com/articles/s41586-024-07817-y&ved=2ahUKEwibm4Gnkb2IAxXYMdAFHa9gA-k4RhDF9AF6BAgGEAI&usg=AOvVaw2RcF9QKCR6ikIU1qK12toA,"data:image/gif;base64,R0lGODlhAQABAIAAAP///////yH5BAEKAAEALAAAAAABAAEAAAICTAEAOw=="
75,COVID-19 FLiRT Variant Top Symptoms,TODAY.com,1 month ago,2024-08-12 04:53:41.992337,"The new ""FLiRT"" COVID-19 variants, including KP.3 and the dominant KP.3.1.1 strain, are on the rise in the US. Experts discuss symptoms, transmission and...",https://www.today.com/health/coronavirus/new-covid-variant-symptoms-2024-flirt-rcna150072&ved=2ahUKEwibm4Gnkb2IAxXYMdAFHa9gA-k4RhDF9AF6BAgBEAI&usg=AOvVaw0z6RtUx3bfxQFmAJB55Rzy,"data:image/gif;base64,R0lGODlhAQABAIAAAP///////yH5BAEKAAEALAAAAAABAAEAAAICTAEAOw=="
76,11 Top COVID Symptoms People Are Experiencing During the Summer Surge,Good Housekeeping,1 month ago,2024-08-12 04:53:41.998105,"There are several COVID variants, some strains are being referred to as FLiRT, while another is LB.1. Here are the COVID symptoms to watch out for this...",https://www.goodhousekeeping.com/health/a61830829/covid-flirt-lb1-variant-symptoms/&ved=2ahUKEwibm4Gnkb2IAxXYMdAFHa9gA-k4RhDF9AF6BAgCEAI&usg=AOvVaw31G7lM9vzSZ0iEjwZA3mIO,"data:image/gif;base64,R0lGODlhAQABAIAAAP///////yH5BAEKAAEALAAAAAABAAEAAAICTAEAOw=="
77,COVID-19 Information,Temple University,1 month ago,2024-08-12 04:53:42.003405,The latest information on the spread of the coronavirus illness is available from the Centers for Disease Control and Prevention (CDC).,https://studenthealth.temple.edu/services/covid-19-information&ved=2ahUKEwibm4Gnkb2IAxXYMdAFHa9gA-k4RhDF9AF6BAgEEAI&usg=AOvVaw0IWcMFNZuBLdXCJvuOdwwO,"data:image/gif;base64,R0lGODlhAQABAIAAAP///////yH5BAEKAAEALAAAAAABAAEAAAICTAEAOw=="
78,Should You Get Another Covid Shot Now?,The New York Times,1 month ago,2024-08-12 04:53:42.008499,"The virus is spreading, but new vaccines coming this fall could offer better protection. We asked experts about the right time for a booster.",https://www.nytimes.com/2024/08/12/well/coronavirus-vaccine-booster.html&ved=2ahUKEwibm4Gnkb2IAxXYMdAFHa9gA-k4RhDF9AF6BAgAEAI&usg=AOvVaw1If_nxJ2qm6ecyhPypsvJx,"data:image/gif;base64,R0lGODlhAQABAIAAAP///////yH5BAEKAAEALAAAAAABAAEAAAICTAEAOw=="
79,The summer COVID surge has arrived. Here’s the latest on symptoms and treatment,Fortune,1 month ago,2024-08-12 04:53:42.013318,"New COVID-19 cases are popping up globally. Here's what experts say you should know about COVID symptoms, treatment, and isolation.",https://fortune.com/well/article/covid-summer-surge-2024-symptoms-treatment-isolation-guidelines/&ved=2ahUKEwibm4Gnkb2IAxXYMdAFHa9gA-k4RhDF9AF6BAgHEAI&usg=AOvVaw3xCYzr5wzVxDb30dt2LMQm,"data:image/gif;base64,R0lGODlhAQABAIAAAP///////yH5BAEKAAEALAAAAAABAAEAAAICTAEAOw=="
80,ICE’s Enforcement and Removal Operations Post Pandemic Emergency COVID-19 Guidelines and Protocols,ICE | U.S. Immigration and Customs Enforcement (.gov),1 month ago,2024-08-12 04:53:42.427700,"On August 2, 2024, ICE released the Post Pandemic Emergency COVID-19 Guidelines and Protocols Version 3.0, which supersedes the Post Pandemic Emergency...",https://www.ice.gov/coronavirus&ved=2ahUKEwjSk5ynkb2IAxUV4ckDHTAxAII4UBDF9AF6BAgFEAI&usg=AOvVaw36-XeOOOrtJ4LQTJeCeWfx,"data:image/gif;base64,R0lGODlhAQABAIAAAP///////yH5BAEKAAEALAAAAAABAAEAAAICTAEAOw=="
81,Covid variant surge: Latest CDC guidelines on isolation and symptoms as cases rise,NBC News,1 month ago,2024-08-12 04:53:42.435197,"Covid variants surge: People who test positive for Covid don't need to isolate for five days, according to recent guidance from the CDC.",https://www.nbcnews.com/health/health-news/covid-isolation-guidelines-cdc-updated-positive-cases-rcna163292&ved=2ahUKEwjSk5ynkb2IAxUV4ckDHTAxAII4UBDF9AF6BAgJEAI&usg=AOvVaw2M9tSq2SlMO2rzXAjjzJG6,"data:image/gif;base64,R0lGODlhAQABAIAAAP///////yH5BAEKAAEALAAAAAABAAEAAAICTAEAOw=="
82,US COVID-19 cases and deaths by state,USAFacts,1 month ago,2024-08-12 04:53:42.441704,"How is the nation faring against COVID-19, both overall and at a state level? Get the answers here, with data on hotspots and infection rates.",https://usafacts.org/visualizations/coronavirus-covid-19-spread-map/&ved=2ahUKEwjSk5ynkb2IAxUV4ckDHTAxAII4UBDF9AF6BAgEEAI&usg=AOvVaw0vmHmehNCeR-6IaN2PX0d6,"data:image/gif;base64,R0lGODlhAQABAIAAAP///////yH5BAEKAAEALAAAAAABAAEAAAICTAEAOw=="
83,UK 'failed citizens' with flawed pandemic plans,BBC,1 month ago,2024-08-12 04:53:42.447468,"Significant flaws in the UK's pandemic planning meant Covid caused more deaths and economic costs than it should have, the first report of the Covid Inquiry...",https://www.bbc.com/news/articles/c6p2dng6z04o&ved=2ahUKEwjSk5ynkb2IAxUV4ckDHTAxAII4UBDF9AF6BAgDEAI&usg=AOvVaw1aSEjOJQ2IzZMkCUmyyT0p,"data:image/gif;base64,R0lGODlhAQABAIAAAP///////yH5BAEKAAEALAAAAAABAAEAAAICTAEAOw=="
84,Biden just got covid. What are the latest coronavirus guidelines?,Washington Post,1 month ago,2024-08-12 04:53:42.452933,Covid isolation guidelines: Americans who test positive for the coronavirus no longer need to routinely stay home from work and school for five days under new...,https://www.washingtonpost.com/health/2024/07/18/biden-covid-guidelines-symptoms/&ved=2ahUKEwjSk5ynkb2IAxUV4ckDHTAxAII4UBDF9AF6BAgCEAI&usg=AOvVaw0PccRmoSejXfsP6GE13cig,"data:image/gif;base64,R0lGODlhAQABAIAAAP///////yH5BAEKAAEALAAAAAABAAEAAAICTAEAOw=="
85,Staying Up to Date with COVID-19 Vaccines,Centers for Disease Control and Prevention | CDC (.gov),1 month ago,2024-08-12 04:53:42.458146,"Everyone ages 6 months and older should get a 2024–2025 COVID-19 vaccine. The COVID-19 vaccine helps protect you from severe disease, hospitalization,...",https://www.cdc.gov/covid/vaccines/stay-up-to-date.html&ved=2ahUKEwjSk5ynkb2IAxUV4ckDHTAxAII4UBDF9AF6BAgGEAI&usg=AOvVaw2DUFtAK9__UqxhQnlweCWt,"data:image/gif;base64,R0lGODlhAQABAIAAAP///////yH5BAEKAAEALAAAAAABAAEAAAICTAEAOw=="
86,Coronavirus Disease 2019 (COVID-19),Centers for Disease Control and Prevention | CDC (.gov),1 month ago,2024-08-12 04:53:42.463050,"Coronavirus Disease 2019 (COVID-19). Español · Illustration of COVID-19 vaccine, vial of vaccine, calendar, and clock. ... People who are up to date with their...",https://www.cdc.gov/covid/index.html&ved=2ahUKEwjSk5ynkb2IAxUV4ckDHTAxAII4UBDF9AF6BAgHEAI&usg=AOvVaw2Q5oZ073_vW1GISwIEeMYq,"data:image/gif;base64,R0lGODlhAQABAIAAAP///////yH5BAEKAAEALAAAAAABAAEAAAICTAEAOw=="
87,How to Protect Yourself and Others | COVID-19,Centers for Disease Control and Prevention | CDC (.gov),2 months ago,2024-07-12 04:53:42.467956,CDC's Respiratory Virus Guidance provides strategies you can use to help protect yourself and others from health risks caused by COVID-19 and other...,https://www.cdc.gov/covid/prevention/index.html&ved=2ahUKEwjSk5ynkb2IAxUV4ckDHTAxAII4UBDF9AF6BAgIEAI&usg=AOvVaw0kOsNnOiWnMwtT-g2CJGBS,"data:image/gif;base64,R0lGODlhAQABAIAAAP///////yH5BAEKAAEALAAAAAABAAEAAAICTAEAOw=="
88,What Are the Symptoms of the New COVID-19 FLiRT Variant?,Everyday Health,2 months ago,2024-07-12 04:53:42.472634,KP.2 is one of several FLiRT coronavirus strains threatening to increase COVID case counts this summer. Here are the main symptoms to watch out for.,https://www.everydayhealth.com/coronavirus/what-are-the-symptoms-of-the-new-covid-19-variant/&ved=2ahUKEwjSk5ynkb2IAxUV4ckDHTAxAII4UBDF9AF6BAgBEAI&usg=AOvVaw3eZme0lPURFA0VHjkryOMA,"data:image/gif;base64,R0lGODlhAQABAIAAAP///////yH5BAEKAAEALAAAAAABAAEAAAICTAEAOw=="
89,Types of COVID-19 Treatment,Centers for Disease Control and Prevention | CDC (.gov),2 months ago,2024-07-12 04:53:42.477137,Medications to treat COVID-19 must be prescribed by a healthcare provider and started within 5–7 days after symptoms appear.,https://www.cdc.gov/covid/treatment/index.html&ved=2ahUKEwjSk5ynkb2IAxUV4ckDHTAxAII4UBDF9AF6BAgAEAI&usg=AOvVaw2xO7bYPrOx54B8W6dziKOx,"data:image/gif;base64,R0lGODlhAQABAIAAAP///////yH5BAEKAAEALAAAAAABAAEAAAICTAEAOw=="
90,Types of COVID-19 Treatment,Centers for Disease Control and Prevention | CDC (.gov),2 months ago,2024-07-12 04:53:42.814636,Medications to treat COVID-19 must be prescribed by a healthcare provider and started within 5–7 days after symptoms appear.,https://www.cdc.gov/covid/treatment/index.html&ved=2ahUKEwjA27inkb2IAxWPGtAFHdy2FQQ4WhDF9AF6BAgDEAI&usg=AOvVaw10tRCRsYxvvK9Xafm3RxbX,"data:image/gif;base64,R0lGODlhAQABAIAAAP///////yH5BAEKAAEALAAAAAABAAEAAAICTAEAOw=="
91,COVID-19,Anne Arundel County Health Department,2 months ago,2024-07-12 04:53:42.823740,The Department of Health offers walk-in COVID-19 vaccine (Pfizer or Moderna) clinics for eligible individuals 6 months through 18 years old only.,https://www.aahealth.org/disease-prevention-and-management/viral-respiratory-illness/covid-19&ved=2ahUKEwjA27inkb2IAxWPGtAFHdy2FQQ4WhDF9AF6BAgJEAI&usg=AOvVaw0ZmSw9mnrXe80pWY_MDilc,"data:image/gif;base64,R0lGODlhAQABAIAAAP///////yH5BAEKAAEALAAAAAABAAEAAAICTAEAOw=="
92,"3 Things to Know About FLiRT and LB.1, the New Coronavirus Strains",Yale Medicine,2 months ago,2024-07-12 04:53:42.831558,"The FLiRT strains are subvariants of Omicron, and together they accounted for the majority of COVID cases in the US at the beginning of July.",https://www.yalemedicine.org/news/3-things-to-know-about-flirt-new-coronavirus-strains&ved=2ahUKEwjA27inkb2IAxWPGtAFHdy2FQQ4WhDF9AF6BAgGEAI&usg=AOvVaw2ZKJn-beT1jLCzSLzy8INi,"data:image/gif;base64,R0lGODlhAQABAIAAAP///////yH5BAEKAAEALAAAAAABAAEAAAICTAEAOw=="
93,Study suggests reinfections from the virus that causes COVID-19 likely have similar severity as original infection,National Institutes of Health (NIH) (.gov),2 months ago,2024-07-12 04:53:42.838293,NIH-funded analysis of health record data shows severe reinfections often follow severe first infections.,https://www.nih.gov/news-events/news-releases/study-suggests-reinfections-virus-causes-covid-19-likely-have-similar-severity-original-infection&ved=2ahUKEwjA27inkb2IAxWPGtAFHdy2FQQ4WhDF9AF6BAgFEAI&usg=AOvVaw3tCUWJlR156eQmJkFV_nhd,"data:image/gif;base64,R0lGODlhAQABAIAAAP///////yH5BAEKAAEALAAAAAABAAEAAAICTAEAOw=="
